{
  "$schema": "https://json-schema.org/draft/2020-12/schema",
  "$id": "https://github.com/mahenarayan/tokn/blob/main/schemas/instructions-lint-report.schema.json",
  "title": "Tokn Instructions Lint Report",
  "type": "object",
  "additionalProperties": false,
  "required": [
    "kind",
    "schemaVersion",
    "schemaPath",
    "preset",
    "detectedPresets",
    "profile",
    "surface",
    "passed",
    "exitCode",
    "failOnSeverity",
    "stats",
    "files",
    "findings",
    "warnings",
    "notes"
  ],
  "properties": {
    "kind": {
      "const": "instructions-lint-report"
    },
    "schemaVersion": {
      "const": "instructions-lint-report/v1"
    },
    "schemaPath": {
      "const": "schemas/instructions-lint-report.schema.json"
    },
    "preset": {
      "enum": ["auto", "copilot", "agents-md"]
    },
    "detectedPresets": {
      "type": "array",
      "items": {
        "enum": ["copilot", "agents-md"]
      }
    },
    "profile": {
      "enum": ["lite", "standard", "strict"]
    },
    "surface": {
      "enum": ["all", "auto", "code-review", "chat", "coding-agent"]
    },
    "model": {
      "type": "string"
    },
    "contextWindow": {
      "type": "number"
    },
    "maxApplicableContextPercent": {
      "type": "number"
    },
    "passed": {
      "type": "boolean"
    },
    "exitCode": {
      "enum": [0, 2]
    },
    "failOnSeverity": {
      "enum": ["off", "warning", "error"]
    },
    "config": {
      "$ref": "#/$defs/appliedConfig"
    },
    "coverage": {
      "$ref": "#/$defs/coverageMap"
    },
    "stats": {
      "$ref": "#/$defs/stats"
    },
    "files": {
      "type": "array",
      "items": {
        "$ref": "#/$defs/fileReport"
      }
    },
    "findings": {
      "type": "array",
      "items": {
        "$ref": "#/$defs/finding"
      }
    },
    "warnings": {
      "type": "array",
      "items": {
        "type": "string"
      }
    },
    "notes": {
      "type": "array",
      "items": {
        "type": "string"
      }
    }
  },
  "$defs": {
    "appliedConfig": {
      "type": "object",
      "additionalProperties": false,
      "required": ["ignore", "suppressionCount", "overriddenRules"],
      "properties": {
        "source": {
          "type": "string"
        },
        "baselinePath": {
          "type": "string"
        },
        "ignore": {
          "type": "array",
          "items": {
            "type": "string"
          }
        },
        "suppressionCount": {
          "type": "number"
        },
        "overriddenRules": {
          "type": "array",
          "items": {
            "$ref": "#/$defs/ruleId"
          }
        },
        "budgetOverrides": {
          "$ref": "#/$defs/budgets"
        },
        "rollout": {
          "$ref": "#/$defs/rollout"
        }
      }
    },
    "budgets": {
      "type": "object",
      "additionalProperties": false,
      "properties": {
        "repositoryChars": { "type": "number" },
        "pathSpecificChars": { "type": "number" },
        "repositoryTokens": { "type": "number" },
        "pathSpecificTokens": { "type": "number" },
        "maxApplicableTokens": { "type": "number" },
        "statements": { "type": "number" },
        "wordsPerStatement": { "type": "number" }
      }
    },
    "rollout": {
      "type": "object",
      "additionalProperties": false,
      "properties": {
        "stage": {
          "enum": ["advisory", "baseline", "enforced"]
        },
        "owner": {
          "type": "string"
        },
        "policyVersion": {
          "type": "string"
        },
        "ticket": {
          "type": "string"
        },
        "expiresOn": {
          "type": "string",
          "pattern": "^\\d{4}-\\d{2}-\\d{2}$"
        }
      }
    },
    "coverageMap": {
      "type": "object",
      "additionalProperties": false,
      "required": [
        "targetFileCount",
        "coveredTargetFileCount",
        "uncoveredTargetFileCount",
        "coveredTargets",
        "uncoveredTargetFilesSample"
      ],
      "properties": {
        "targetFileCount": { "type": "number" },
        "coveredTargetFileCount": { "type": "number" },
        "uncoveredTargetFileCount": { "type": "number" },
        "coveredTargets": {
          "type": "array",
          "items": { "$ref": "#/$defs/coverageTarget" }
        },
        "uncoveredTargetFilesSample": {
          "type": "array",
          "items": { "type": "string" }
        }
      }
    },
    "coverageTarget": {
      "type": "object",
      "additionalProperties": false,
      "required": ["targetFile", "estimatedTokens", "instructionCount", "instructionFiles"],
      "properties": {
        "targetFile": { "type": "string" },
        "estimatedTokens": { "type": "number" },
        "instructionCount": { "type": "number" },
        "instructionFiles": {
          "type": "array",
          "items": { "type": "string" }
        }
      }
    },
    "stats": {
      "type": "object",
      "additionalProperties": false,
      "required": [
        "totalFiles",
        "repositoryFiles",
        "pathSpecificFiles",
        "unsupportedFiles",
        "totalStatements",
        "applicableStatements",
        "totalChars",
        "totalEstimatedTokens",
        "applicableFiles",
        "applicableEstimatedTokens",
        "totalMatchedFiles",
        "maxApplicableTokens",
        "ignoredInstructionFileCount",
        "ignoredTargetFileCount",
        "suppressedFindingCount",
        "baselineMatchedFindingCount",
        "warningCount",
        "errorCount"
      ],
      "properties": {
        "totalFiles": { "type": "number" },
        "repositoryFiles": { "type": "number" },
        "pathSpecificFiles": { "type": "number" },
        "unsupportedFiles": { "type": "number" },
        "totalStatements": { "type": "number" },
        "applicableStatements": { "type": "number" },
        "totalChars": { "type": "number" },
        "totalEstimatedTokens": { "type": "number" },
        "applicableFiles": { "type": "number" },
        "applicableEstimatedTokens": { "type": "number" },
        "totalMatchedFiles": { "type": "number" },
        "maxApplicableTokens": { "type": "number" },
        "maxApplicableTargetFile": { "type": "string" },
        "ignoredInstructionFileCount": { "type": "number" },
        "ignoredTargetFileCount": { "type": "number" },
        "suppressedFindingCount": { "type": "number" },
        "baselineMatchedFindingCount": { "type": "number" },
        "warningCount": { "type": "number" },
        "errorCount": { "type": "number" }
      }
    },
    "fileReport": {
      "type": "object",
      "additionalProperties": false,
      "required": [
        "file",
        "kind",
        "appliesToSurface",
        "chars",
        "words",
        "estimatedTokens",
        "statementCount",
        "findings"
      ],
      "properties": {
        "file": { "type": "string" },
        "kind": {
          "enum": ["repository", "path-specific", "unsupported"]
        },
        "preset": {
          "enum": ["copilot", "agents-md"]
        },
        "applyTo": {
          "type": "array",
          "items": { "type": "string" }
        },
        "description": { "type": "string" },
        "scopePath": { "type": "string" },
        "excludeAgents": {
          "type": "array",
          "items": {
            "enum": ["code-review", "coding-agent"]
          }
        },
        "appliesToSurface": { "type": "boolean" },
        "chars": { "type": "number" },
        "words": { "type": "number" },
        "estimatedTokens": { "type": "number" },
        "statementCount": { "type": "number" },
        "statementEstimates": {
          "type": "array",
          "items": { "$ref": "#/$defs/statementEstimate" }
        },
        "matchedFileCount": { "type": "number" },
        "findings": {
          "type": "array",
          "items": { "$ref": "#/$defs/finding" }
        }
      }
    },
    "statementEstimate": {
      "type": "object",
      "additionalProperties": false,
      "required": ["line", "sourceType", "chars", "words", "estimatedTokens", "text"],
      "properties": {
        "line": { "type": "number" },
        "sourceType": {
          "enum": ["bullet", "numbered", "paragraph"]
        },
        "chars": { "type": "number" },
        "words": { "type": "number" },
        "estimatedTokens": { "type": "number" },
        "text": { "type": "string" }
      }
    },
    "findingLocation": {
      "type": "object",
      "additionalProperties": false,
      "required": ["file", "line"],
      "properties": {
        "file": { "type": "string" },
        "line": { "type": "number" }
      }
    },
    "findingEvidence": {
      "type": "object",
      "additionalProperties": false,
      "properties": {
        "actual": {
          "oneOf": [{ "type": "number" }, { "type": "string" }]
        },
        "expected": {
          "oneOf": [{ "type": "number" }, { "type": "string" }]
        },
        "surface": {
          "enum": ["all", "auto", "code-review", "chat", "coding-agent"]
        },
        "relatedLocation": {
          "$ref": "#/$defs/findingLocation"
        },
        "overlapFileCount": { "type": "number" },
        "overlapFilesSample": {
          "type": "array",
          "items": { "type": "string" }
        },
        "matchedFileCount": { "type": "number" },
        "matchedFilesSample": {
          "type": "array",
          "items": { "type": "string" }
        },
        "similarityScore": { "type": "number" },
        "patterns": {
          "type": "array",
          "items": { "type": "string" }
        },
        "targetFile": { "type": "string" },
        "contributorFiles": {
          "type": "array",
          "items": { "type": "string" }
        }
      }
    },
    "finding": {
      "type": "object",
      "additionalProperties": false,
      "required": ["ruleId", "severity", "message", "file", "line"],
      "properties": {
        "ruleId": {
          "$ref": "#/$defs/ruleId"
        },
        "severity": {
          "enum": ["warning", "error"]
        },
        "category": {
          "enum": ["compatibility", "clarity", "economy", "drift"]
        },
        "confidence": {
          "enum": ["low", "medium", "high"]
        },
        "surfaceApplicability": {
          "type": "array",
          "items": {
            "enum": ["all", "auto", "code-review", "chat", "coding-agent"]
          }
        },
        "activationType": {
          "enum": ["repository", "path", "description", "directory", "unsupported"]
        },
        "groupId": { "type": "string" },
        "message": { "type": "string" },
        "file": { "type": "string" },
        "line": { "type": "number" },
        "suggestion": { "type": "string" },
        "evidence": {
          "$ref": "#/$defs/findingEvidence"
        }
      }
    },
    "ruleId": {
      "enum": [
        "invalid-file-path",
        "unsupported-agent-surface",
        "malformed-frontmatter",
        "missing-frontmatter",
        "missing-applyto",
        "invalid-exclude-agent",
        "global-applyto-overlap",
        "stale-applyto",
        "file-char-limit",
        "repository-char-budget",
        "repository-token-budget",
        "path-specific-char-budget",
        "path-specific-token-budget",
        "statement-count-budget",
        "order-dependent-wording",
        "statement-too-long",
        "weak-modal-phrasing",
        "vague-instruction",
        "paragraph-narrative",
        "oversized-code-example",
        "repo-wide-scoped-topics",
        "exact-duplicate-statement",
        "possible-conflict",
        "high-similarity-statement",
        "applicable-token-budget",
        "missing-file-reference",
        "missing-command-reference",
        "missing-symbol-reference"
      ]
    }
  }
}
